Award ID,Directorate,Recipient,Title,Obligated,,Date of export: 6/5/2025
2135669,ENG ,University of Colorado at Boulder                               ,"BRITE Synergy: Engineering More Resilient Housing through Inclusion  of Women's Knowledge, Priorities and Perceptions","$399,521 ",,
2135767,GEO ,Ohio State University                                           ,Creating inclusive workspaces that foster and support BAJEDI leaders in the Big Ten Academic Alliance of geoscientists,"$99,806 ",,
2136141,GEO ,Brown University                                                ,EAGER: Collaborative Research: Enhancing Asian American and Pacific Islander Participation and Belonging in the Geosciences,"$209,243 ",,
2137338,CSE ,Temple University                                               ,Collaborative Research: BPC-AE: STARS: Catalyzing Action-Oriented Academic Communities for Broadening Participation in Computing,"$2,237,296 ",,
2137393,CSE ,Florida State University                                        ,Collaborative Research: BPC-AE: STARS: Catalyzing Action-Oriented Academic Communities for Broadening Participation in Computing,"$57,000 ",,
2137410,GEO ,George Washington University                                    ,Understanding the Gendered Impacts of COVID-19 in the Arctic,"$660,422 ",,
2137723,MPS ,Harvard University                                              ,QuIC-TAQS: Integrated Lithium Niobate Quantum Photonics Platform,"$2,500,000 ",,
2137928,CSE ,University of California-San Diego                              ,BPC-DP: Inclusive longitudinal peer mentoring for community building and retention,"$313,302 ",,
2138047,SBE ,Lehigh University                                               ,"Women in Cognitive Science: Networking, Visibility, and Career Pathways","$59,891 ",,
2138730,BIO ,Botanical Society of America                                    ,Preparing Leaders and Nurturing Tomorrows Scientists: Botany and Beyond (PLANTS III),"$986,448 ",,
2139096,ENG ,University of Arizona                                           ,Addressing Demographic Disparities in Students Choice of Engineering Disciplines (ADDS-CoED),"$454,335 ",,
2139125,MPS ,University of Wisconsin-Madison                                 ,"Conference in Geometry, Topology, and Dynamics: Celebrating the Work of Diverse Mathematicians","$7,508 ",,
2140043,MPS ,Harvard University                                              ,2021 Waterman Award,"$1,000,000 ",,
2140246,EDU ,Howard University                                               ,"Collaborative Research: Black Research Support Network: Studying Change By, With, and For Black Undergraduate Computer Science Faculty & Students at Three Institutions","$521,763 ",,
2140262,EDU ,City Colleges of Chicago Harry S Truman College                 ,"ADVANCE Catalyst: Truman College ADVANCE Catalyst Participatory Action Research- Building a sense of ""voice"" among STEM faculty","$274,762 ",,
2140601,ENG ,University of Colorado at Boulder                               ,Research: Engineering for Social Justice: Factors shaping the career aspirations and mindsets of humanitarian engineers,"$349,985 ",,
2140646,EDU ,University of San Diego                                         ,Co-Constructing Faculty Critical Consciousness In Engineering Education,"$464,828 ",,
2140647,EDU ,University of Texas at San Antonio                              ,Co-Constructing Faculty Critical Consciousness In Engineering Education,"$119,324 ",,
2140696,EDU ,University of Florida                                           ,Critical Conversations: Systemic and Agentic Empowerment of Black Ph.D. Students and their Faculty Advisors in Engineering,"$1,023,826 ",,
2140743,EDU ,Harvard University                                              ,Graduate Research Fellowship Program (GRFP),"$43,051,421 ",,
2140867,EDU ,University of North Carolina at Charlotte                       ,"Collaborative Research: Black Research Support Network: Studying Change By, With, and For Black Undergraduate Computer Science Faculty & Students at Three Institutions","$769,149 ",,
2140891,EDU ,Georgia Tech Research Corporation                               ,Collaborative Research: Understanding Persistence through the Lens of Interruption: A Framework for Transformation (UPLIFT),"$822,120 ",,
2140892,EDU ,Albany State University                                         ,Collaborative Research: Understanding Persistence through the Lens of Interruption: A Framework for Transformation (UPLIFT),"$502,307 ",,
2140902,EDU ,"Georgia State University Research Foundation, Inc.              ",Examining Blackness in Postsecondary STEM Education through a Multidimensional-Multiplicative Lens,"$888,676 ",,
2140903,EDU ,American University                                             ,Examining Blackness in Postsecondary STEM Education through a Multidimensional-Multiplicative Lens,"$1,056,052 ",,
2140904,EDU ,University of Texas at Austin                                   ,Examining Blackness in Postsecondary STEM Education through a Multidimensional-Multiplicative Lens,"$767,625 ",,
2140905,EDU ,North Carolina Agricultural & Technical State University        ,Examining Blackness in Postsecondary STEM Education through a Multidimensional-Multiplicative Lens,"$908,881 ",,
2140922,EDU ,University of Colorado at Boulder                               ,Collaborative Research: Inspiring Networks and Sustainability of Postsecondary Inclusivity and Racial Equity with the Computing Alliance of HSIs,"$307,884 ",,
2140987,SBE ,"University of Maryland, College Park                            ",SBP: CAREER: Inferior and foreign racial stereotypes give rise to exploitative and exclusionary discrimination,"$485,350 ",,
2141289,SBE ,University of Tennessee Knoxville                               ,"Collaborative Research: The Angry Crowd Bias: Social, Cognitive, and Perceptual Mechanisms","$272,286 ",,
2141313,SBE ,University of Denver                                            ,"Collaborative Research: The Angry Crowd Bias: Social, Cognitive, and Perceptual Mechanisms","$302,713 ",,
2141326,SBE ,University of Delaware                                          ,SBP: Collaborative Research: The impact of naturally occurring and experimentally manipulated interracial contact on social cognition,"$420,931 ",,
2141328,SBE ,University of Colorado at Boulder                               ,SBP: Collaborative Research: The impact of naturally occurring and experimentally manipulated interracial contact on social cognition,"$88,485 ",,
2141345,SBE ,Florida State University                                        ,Threat is Distinct from Valence as a Source of Biased Shoot Behaviors toward Black Men,"$413,000 ",,
2141382,GEO ,Harvard University                                              ,"Collaborative Research: Coupled flow-geomechanical models applied to assess earthquake triggering in tectonically active regions – The Los Angeles basin, CA","$329,628 ",,
2142657,EDU ,University of California-Berkeley                               ,Collaborative Research: Challenging Anti-Black-Racism in Civil and Environmental Engineering Curriculum,"$500,000 ",,
2142714,EDU ,University of South Florida                                     ,Collaborative Research: Challenging Anti-Black-Racism in Civil and Environmental Engineering Curriculum,"$1,500,000 ",,
2142739,CSE ,University of Washington                                        ,CAREER: Language Technologies Against the Language of Social Discrimination,"$342,171 ",,
2143077,CSE ,Harvard University                                              ,CAREER: Defining how the primate visual system works under naturalistic conditions,"$598,566 ",,
2143173,ENG ,Florida International University                                ,CAREER: An Asset-based Longitudinal and Intersectional Analysis of Black Women’s Experiences within Informal and Formal Engineering Education,"$547,447 ",,
2143177,MPS ,Harvard University                                              ,CAREER: Observing topological magnetoelectric effects by magneto-optics and quantum transport,"$696,416 ",,
2143343,SBE ,Harvard University                                              ,CAREER: The AI Revolution and Autocratic Institutions,"$405,389 ",,
2143811,MPS ,University of Colorado at Boulder                               ,CAREER: From Equivariant Chromatic Homotopy Theory to Phases of Matter: Voyage to the Edge,"$307,434 ",,
2143867,ENG ,Ohio State University                                           ,CAREER: Enabling Transformational Service-Learning in Engineering through Critically Reflexive Practice,"$362,867 ",,
2143934,SBE ,Cornell University                                              ,CAREER: The Domestic and International Politics of Global Police,"$491,535 ",,
2143993,EDU ,University of California-San Diego                              ,CAREER: Designing teacher professional development to leverage the brilliance of learners of color,"$500,569 ",,
2144506,EDU ,University of Wisconsin-Madison                                 ,CAREER: Advancing Equity in Middle School Mathematics by Engaging Students and Families of Color in Participatory Design Research,"$702,535 ",,
2144618,EDU ,University of North Carolina at Charlotte                       ,CAREER:  Fostering Early STEM Exploration with Gifted and High Ability Black Girls and Their Elementary Teachers through Culturally Relevant Experiential Learning Activities,"$727,541 ",,
2144978,EDU ,Virginia Polytechnic Institute and State University             ,CAREER: Sustainable Racial Equity: Creating a New Generation of Engineering Education DEI Leaders,"$335,644 ",,
2145011,EDU ,University of Chicago                                           ,"CAREER: Developing Informed Portraits of the Educational Experiences of Homeless, Black High-Achieving Adolescents","$398,732 ",,
2145105,EDU ,University of the District of Columbia                          ,CAREER Exploring the Role of STEM Faculty Beliefs & Classroom Culture on Undergraduate Minoritized Students Experiences Achievement and Persistence in STEM,"$1,262,459 ",,
2145783,CSE ,University of Colorado at Boulder                               ,CAREER: Combating Censorship from within the Network,"$458,019 ",,
2145925,BIO ,Harvard University                                              ,CAREER: Linking systemic stem cell activation to vertebrate limb regeneration,"$812,400 ",,
2145961,ENG ,Florida International University                                ,CAREER: Better Together: Leveraging the Shared Commitment of Community Colleges and HBCUs to Optimize Black Engineering Student Pathways,"$646,092 ",,
2146363,EDU ,Colorado State University                                       ,CAREER: Critically examining chemistry culture to support adoption of multiculturally inclusive practices,"$543,913 ",,
2146448,CSE ,University of Texas at Dallas                                   ,CAREER: Empowering White-box Driven Analytics to Detect AI-synthesized Deceptive Content,"$297,562 ",,
2146613,EDU ,"CAST, Inc.                                                      ","Using drone technology, communal motivation, and strength-based approaches to engage middle school female students from rural areas in STEM","$1,500,000 ",,
2146983,SBE ,Lehigh University                                               ,Collaborative Research: Using Causal Explanations and Computation to Understand Misplaced Beliefs,"$367,047 ",,
2146984,SBE ,Stevens Institute of Technology                                 ,Collaborative Research: Using Causal Explanations and Computation to Understand Misplaced Beliefs,"$206,682 ",,
2147011,SBE ,University of California-Irvine                                 ,Diversity and Networking in Law School: Are Law Students from Diverse Backgrounds Disadvantaged?,"$511,230 ",,
2147258,SBE ,University of Iowa                                              ,Collaborative Research: Digital Archives and Indigenous Afterlives of Scientific Objects,"$111,903 ",,
2147284,SBE ,New Jersey Institute of Technology                              ,Collaborative Research: Digital Archives and Indigenous Afterlives of Scientific Objects,"$302,085 ",,
2147305,CSE ,University of Connecticut                                       ,FAI: BRIMI - Bias Reduction In Medical Information,"$392,994 ",,
2147325,SBE ,Emory University                                                ,Collaborative Research: Digital Archives and Indigenous Afterlives of Scientific Objects,"$84,062 ",,
2147450,SBE ,University of Houston                                           ,"Residential Segregation, Health-Promoting Organizations, and Health Outcomes","$191,062 ",,
2147635,SBE ,University of Oklahoma Norman Campus                            ,Collaborative Research: Understanding the Evolution of Political Campaign Advertisements over the Last Century,"$300,519 ",,
2147694,CSE ,Harvard University                                              ,Collaborative Research: SaTC: CORE: Medium: Foundations of Trust-Centered Multi-Agent Distributed Coordination,"$489,462 ",,
2147818,SBE ,University of California - Merced                               ,The Effects of the COVID-19 Pandemic on Latinx College Graduates,"$155,725 ",,
2147839,EDU ,University of Minnesota-Twin Cities                             ,Employing Peer Mentoring to Empower Youth to Become 21st Century Energy Leaders,"$1,143,464 ",,
2147848,SBE ,University of Arizona                                           ,"The Law and Reproductive Health, 2010-2020","$432,912 ",,
2148014,EDU ,San Jose State University Foundation                            ,CAREER - Transforming Science Teaching and Learning through Empowering Teachers and Students as Climate Justice Action Researchers and Change Agents,"$610,031 ",,
2148016,EDU ,Arizona State University                                        ,Engaging Latinx Youth in Understanding the Science of Climate Change by Developing Digital Narratives and Games,"$431,984 ",,
2148023,EDU ,Twin Cities Public Television                                   ,STEM Tales: Investigating the effect of media read-alouds on young children's STEM and literacy learning and interest in STEM careers,"$1,448,995 ",,
2148202,SBE ,University of Iowa                                              ,Collaborative Research: Understanding the Evolution of Political Campaign Advertisements over the Last Century,"$82,608 ",,
2148560,EDU ,University of Houston                                           ,Collaborative Research: Enhancing Underrepresented Student Engagement in STEM through Mentoring and Family Involvement,"$739,486 ",,
2148561,EDU ,Regents of the University of Michigan - Ann Arbor               ,Collaborative Research: Enhancing Underrepresented Student Engagement in STEM through Mentoring and Family Involvement,"$60,439 ",,
2148606,EDU ,University of Connecticut                                       ,"Engaging Underrepresented Populations in Environmental Action through Mentoring, Geospatial Technology and Digital Media Storytelling","$1,350,000 ",,
2148704,GEO ,University of Rhode Island                                      ,Collaborative Research: Enhancing MPOWIR to Build a Diverse and Inclusive Oceanography Workforce,"$579,183 ",,
2148705,GEO ,University of Georgia Research Foundation Inc                   ,Collaborative Research: Enhancing MPOWIR to Build a Diverse and Inclusive Oceanography Workforce,"$147,021 ",,
2148739,EDU ,Purdue University                                               ,Fostering STEM identify development through localized engineering for LGBTQ+ youth displaced by housing insecurity,"$394,861 ",,
2148889,SBE ,Texas A&M University                                            ,Explaining Changes in Racial Identification across Time and Place,"$399,943 ",,
2148920,SBE ,George Washington University                                    ,"Memorialization, Contested Knowledge, and the Sociopsychological Impacts of Disinformation in the Context of COVID-19","$398,317 ",,
2148928,SBE ,Harvard University                                              ,Collaborative Research: Understanding the Evolution of Political Campaign Advertisements over the Last Century,"$155,357 ",,
2148971,SBE ,Urban Institute                                                 ,Prison Proliferation Project,"$400,000 ",,
2149053,SBE ,University of Minnesota-Twin Cities                             ,"Environmental Stress, Political Institutions and Social Conflict","$407,554 ",,
2149059,SBE ,University of South Florida                                     ,Migrant communities: Effects of demographic characteristics on place making under uncertain timelines,"$268,939 ",,
2149223,SBE ,Yale University                                                 ,"Collaborative Research: Gender, Politics, and Environmental Concern","$238,600 ",,
2149321,SBE ,University of Texas at San Antonio                              ,DDRIG in DRMS: An Investigation of Harm Perceptions from Communications on Social Media about COVID Vaccines,"$29,850 ",,
2149798,EDU ,Johns Hopkins University                                        ,Collaborative Research: AGEP FC-PAM: Project ELEVATE (Equity-focused Launch to Empower and Value AGEP Faculty to Thrive in Engineering),"$499,653 ",,
2149849,EDU ,Framingham State University                                     ,Collaborative Research: The AGEP Massachusetts State University System Equity-Minded Model for Recruiting and Advancing Early Career Faculty in the STEM Professoriate,"$1,122,960 ",,
2149858,EDU ,BRIDGEWATER STATE UNIVERSITY                                    ,Collaborative Research: The AGEP Massachusetts State University System Equity-Minded Model for Recruiting and Advancing Early Career Faculty in the STEM Professoriate,"$366,925 ",,
2149883,EDU ,Worcester State University                                      ,Collaborative Research: The AGEP Massachusetts State University System Equity-Minded Model for Recruiting and Advancing Early Career Faculty in the STEM Professoriate,"$387,200 ",,
2149899,EDU ,New York University                                             ,Collaborative Research: AGEP FC-PAM: Project ELEVATE (Equity-focused Launch to Empower and Value AGEP Faculty to Thrive in Engineering),"$463,266 ",,
2149995,EDU ,Carnegie-Mellon University                                      ,Collaborative Research: AGEP FC-PAM: Project ELEVATE (Equity-focused Launch to Empower and Value AGEP Faculty to Thrive in Engineering),"$774,777 ",,
2150045,EDU ,Metropolitan State University of Denver                         ,"HSI Implementation and Evaluation Project: Building STEM identity to improve persistence, graduation and progression into STEM careers for diverse students","$999,167 ",,
2150057,EDU ,Houston Baptist University                                      ,HSI Pilot Project: Developing an Inquiry-Based Research Module to Promote Academic Success in a Diverse Undergraduate STEM Student Population,"$199,905 ",,
2150103,EDU ,New Mexico Highlands University                                 ,Cultivating Access to Manifest INtentional Outcomes in STEM (CAMINOS),"$995,713 ",,
2150262,GEO ,University of Colorado at Boulder                               ,"REU Site: Atmospheric, Oceanic, and Cryospheric Sciences at the University of Colorado Boulder","$524,512 ",,
2150290,GEO ,Harvard University                                              ,REU Site: Summer Program at Harvard in Earth and Environmental Research (SPHEER): Investigating a changing planet across multiple timescales,"$523,416 ",,
2150298,EDU ,Rio Hondo College                                               ,Transitions and Research Across  Interfaces (TRAINS),"$999,504 ",,
2150323,EDU ,San Francisco State University                                  ,HSI Implementation and Evaluation Project: Self-sustaining Peer Mentor Support System for Computer Science Students,"$499,947 ",,
2150364,EDU ,TERC Inc                                                        ,REU Site: STEM Education Research through a Social Justice Lens,"$348,540 ",,
2150415,ENG ,University of Houston                                           ,"REU Site: Neurotechnologies to Help the Body Move, Heal, and Feel Again","$402,511 ",,
2150423,EDU ,CUNY John Jay College of Criminal Justice                       ,HSI Pilot Project: Including others in the teaching and practice of STEM disciplines,"$199,982 ",,
2150454,EDU ,Menlo College                                                   ,HSI Pilot Project: Improving Undergraduate Biology Courses to Enhance Student Achievement and Interest in Biology and Related Coursework and Careers,"$199,751 ",,
2150461,EDU ,University of Puerto Rico Mayaguez                              ,"HSI Implementation and Evaluation Project: Paradigm for Sustainability and Resilience Engineering: A Transdisciplinary, Learner-Centered, and Diversity-Focused Approach","$499,381 ",,
2150680,EDU ,Southern Utah University                                        ,"Collaborative Research: Chemistry Education Research through the Lens of Equity, Diversity, and Inclusion Conference","$23,489 ",,
2150716,CSE ,University of California-Davis                                  ,Collaborative Research: SaTC: CORE: Small: Understanding how visual features of misinformation influence credibility perceptions,"$285,000 ",,
2150723,CSE ,University of Georgia Research Foundation Inc                   ,Collaborative Research: SaTC: CORE: Small: Understanding how visual features of misinformation influence credibility perceptions,"$214,999 ",,
2150727,EDU ,Regents of the University of Michigan - Ann Arbor               ,"Collaborative Research: Chemistry Education Research through the Lens of Equity, Diversity, and Inclusion Conference","$21,741 ",,
2150787,EDU ,Eastern Washington University                                   ,"Expanding collaborations that recruit, prepare, and retain diverse and highly-qualified STEM teachers in Eastern Washington","$853,051 ",,
2150813,SBE ,Harvard University                                              ,Collaborative Research: Reconstructing Classic Genetic and Social Kinship Networks,"$261,102 ",,
2150922,EDU ,University of Rochester                                         ,"Developing Digitally-rich Urban Teacher Leaders: Fostering and Sustaining a STEM Culture of Belonging, Access, Justice, Equity, Diversity, and Inclusion","$2,047,099 ",,
2151061,EDU ,University of West Florida                                      ,Educating Science and Mathematics Majors to Teach with Social Justice Models in High-Needs Schools,"$871,573 ",,
2151294,BIO ,Harvard University                                              ,Remote homology detection with evolutionary profile HMMs,"$665,188 ",,
2151311,SBE ,University of Minnesota-Twin Cities                             ,Factors Relating to Successful Recruitment of Women in Information Technology Jobs,"$407,450 ",,
2151404,ENG ,University of Texas at San Antonio                              ,CAREER: Breaking the Tradition of Silence through Conocimiento and Consciousness Raising among Latinx Engineers,"$572,771 ",,
2152149,MPS ,Harvard University                                              ,FRG: Collaborative Research:  Definability and Computability over Arithmetically Significant Fields,"$203,163 ",,
2152437,SBE ,University of Kansas Center for Research Inc                    ,SCISIPBIO: Examining the Career Barriers Confronting African American or Black Biomedical Scientists,"$408,187 ",,
2152441,ENG ,University of Cincinnati Main Campus                            ,Studying Undergraduate Curricular Complexity for Engineering Student Success (SUCCESS),"$349,936 ",,
2152456,SBE ,George Mason University                                         ,The Racial Gap in Entrepreneurship and Business Ownership,"$350,000 ",,
2152524,EDU ,Western Michigan University                                     ,"ADVANCE Partnership: Faculty Online Learning Communities for Gender Equity, Targeting Department Level Change in STEM","$256,319 ",,
2152834,ENG ,Villanova University                                            ,CAS- Climate: CDS&E: Facilitating Sustainable and Fair Transformation of GSI through AI,"$499,536 ",,
2152991,MPS ,Harvard University                                              ,Interactions of Combinatorics and Physics,"$440,000 ",,
2153335,MPS ,Harvard University                                              ,"Random Matrices, Random Schrödinger Operators, and Applications","$330,000 ",,
2154118,CSE ,Georgia Tech Research Corporation                               ,Collaborative Research: SaTC: CORE: Medium: An Incident-Response Approach for Empowering Fact-Checkers,"$428,000 ",,
2154119,CSE ,New York University                                             ,Collaborative Research: SaTC: CORE: Medium: An Incident-Response Approach for Empowering Fact-Checkers,"$396,000 ",,
2154123,CSE ,University of Utah                                              ,Collaborative Research: SaTC: CORE: Medium: An Incident-Response Approach for Empowering Fact-Checkers,"$441,200 ",,
2154245,BIO ,Harvard University                                              ,"Collaborative Research: PurSUiT: Understanding the Neotropical Velvet Worms (Onychophora, Peripatidae, Neopatida), a Cretaceous Radiation of Terrestrial Panarthropods","$809,585 ",,
2200066,SBE ,Lehigh University                                               ,PIPP Phase I: Dynamics of Pandemic Spread and Prevention in Indigenous Communities,"$999,894 ",,
2200323,EDU ,CSUB Auxiliary for Sponsored Programs Administration            ,ADVANCE Catalyst: Organizational Change for Gender Equity in STEM Academic Professions,"$299,949 ",,
