Award ID,Directorate,Recipient,Title,Obligated,,Date of export: 6/5/2025
1231319,MPS ,Harvard University                                              ,Center for Integrated Quantum Materials,"$44,434,393 ",,
1432910,EDU ,Regents of the University of Idaho                              ,"Collaborative Research: The Pacific Northwest Alliance to Develop, Implement and Study a STEM Graduate Education Model for American Indians and Native Alaskans","$1,257,442 ",,
1661201,EDU ,Purdue University                                               ,Collaborative Research: Identity Development Evaluation of African American Science Students (IDEAAS): A Longitudinal Investigation,"$555,089 ",,
1712692,EDU ,Auburn University                                               ,The Greater Alabama Black Belt Region (GABBR) LSAMP,"$4,999,995 ",,
1723165,EDU ,Texas A&M University Corpus Christi                             ,Collaborative Research: The Texas A&M System AGEP Alliance: A Model to Advance Historically Underrepresented Minorities in the STEM Professoriate,"$614,061 ",,
1723209,EDU ,CUNY City College                                               ,Collaborative Research: The Hispanic AGEP Alliance for the Environmental Science and Engineering Professoriate in Community Colleges and Associate Degree Programs,"$2,315,184 ",,
1723245,EDU ,University of Texas at El Paso                                  ,Collaborative Research: The Hispanic AGEP Alliance for the Environmental Science and Engineering Professoriate in Community Colleges and Associate Degree Programs,"$1,262,377 ",,
1736019,EDU ,University of Puerto Rico Medical Sciences Campus               ,Puerto Rico Center for Environmental Neuroscience (Cycle II),"$5,100,000 ",,
1743117,MPS ,University of California-Santa Cruz                             ,Advancing Inclusive Leaders in Astronomy,"$1,420,207 ",,
1761287,EDU ,Xavier University of Louisiana                                  ,Xavier ADVANCE Adaptation - Supporting Transformation: Intersectional Directions to Engender Success (STrIDES),"$1,013,337 ",,
1817314,EDU ,Ohio State University                                           ,The Ohio LSAMP Alliance,"$4,695,442 ",,
1817519,EDU ,Columbus State University                                       ,Louis Stokes STEM Pathways Implementation - Only Alliance: The Southwestern Georgia STEM Pathways Alliance,"$3,000,000 ",,
1817537,EDU ,Kansas State University                                         ,Louis Stokes STEM Pathways Implementation-Only Alliance: Kansas Pathways to STEM,"$2,999,999 ",,
1820536,EDU ,North Carolina State University                                 ,Collaborative Research: AGEP North Carolina Alliance: An Institutional Transformation Model to Increase Minority STEM Doctoral Student and Faculty Success,"$930,081 ",,
1820538,EDU ,North Carolina Agricultural & Technical State University        ,Collaborative Research: AGEP North Carolina Alliance: An Institutional Transformation Model to Increase Minority STEM Doctoral Student and Faculty Success,"$761,280 ",,
1820582,EDU ,University of North Carolina at Charlotte                       ,Collaborative Research: AGEP North Carolina Alliance: An Institutional Transformation Model to Increase Minority STEM Doctoral Student and Faculty Success,"$992,789 ",,
1820875,EDU ,University of California - Merced                               ,Collaborative Research: The AGEP California Hispanic Serving Institutions (HSI) Alliance to Increase Underrepresented Minority Faculty in STEM,"$621,039 ",,
1820876,EDU ,California State University-Fresno Foundation                   ,Collaborative Research: The AGEP California Hispanic Serving Institutions (HSI) Alliance to Increase Underrepresented Minority Faculty in STEM,"$278,029 ",,
1820886,EDU ,University of California-Santa Barbara                          ,Collaborative Research: The AGEP California Hispanic Serving Institutions (HSI) Alliance to Increase Underrepresented Minority Faculty in STEM,"$1,264,017 ",,
1820895,EDU ,California State University Channel Islands                     ,Collaborative Research: The AGEP California Hispanic Serving Institutions (HSI) Alliance to Increase Underrepresented Minority Faculty in STEM,"$528,260 ",,
1820971,EDU ,Salisbury University                                            ,The AGEP Alliance State System Model to Transform the Hiring Practices and Career Success of Tenure Track Historically Underrepresented Minority Faculty in Biomedical Sciences,"$317,879 ",,
1820975,EDU ,"University of Maryland, College Park                            ",The AGEP Alliance State System Model to Transform the Hiring Practices and Career Success of Tenure Track Historically Underrepresented Minority Faculty in Biomedical Sciences,"$812,798 ",,
1820984,EDU ,University of Maryland Baltimore County                         ,The AGEP Alliance State System Model to Transform the Hiring Practices and Career Success of Tenure Track Historically Underrepresented Minority Faculty in Biomedical Sciences,"$1,512,798 ",,
1821083,EDU ,SUNY at Stony Brook                                             ,Collaborative Research: An AGEP Alliance Model to Advance Underrepresented Minority STEM Faculty at Predominately Undergraduate Institutions,"$1,571,365 ",,
1821298,EDU ,Georgia Tech Applied Research Corporation                       ,Collaborative Research: The AGEP Engineering Alliance: A Model to Advance Historically Underrepresented Minority Postdoctoral Scholars and Early Career Faculty in Engineering,"$936,697 ",,
1821510,EDU ,Trustees of Boston University                                   ,Collaborative Research: IUSE EHR - Inclusive Learning and Teaching in Undergraduate STEM Instruction,"$419,925 ",,
1821684,EDU ,Northwestern University                                         ,Collaborative Research: IUSE EHR - Inclusive Learning and Teaching in Undergraduate STEM Instruction,"$1,378,170 ",,
1824015,EDU ,Virginia Commonwealth University                                ,Overcoming Immunity to Change (ITC): ADVANCE IT VCU,"$2,999,676 ",,
1824260,EDU ,Arizona State University                                        ,ASU ADVANCE Institutional Transformation,"$2,999,743 ",,
1826738,EDU ,Louisiana State University                                      ,Louis Stokes Regional Center of Excellence: LSAMP - NSF International Center of Excellence (NICE),"$629,245 ",,
1826745,EDU ,University of Texas at El Paso                                  ,Louis Stokes STEM Pathways and Research Alliance: University of Texas System LSAMP,"$4,796,618 ",,
1826763,EDU ,University of Kentucky Research Foundation                      ,Louis Stokes STEM Pathways and Research Alliance: KY-WV LSAMP,"$3,500,000 ",,
1826797,EDU ,Clark Atlanta University                                        ,Mentoring Effectiveness in Undergraduate Research: An Examination of Its Impacts on Minority Students? Self-Efficacy and Persistence in STEM Fields,"$3,971,561 ",,
1826826,EDU ,Louisiana State University                                      ,Louis Stokes Regional Center of Excellence: Center for Promotion of Academic Careers through Motivational Opportunities to Develop Emerging Leaders in STEM (LS-PAC MODELS),"$2,499,999 ",,
1826954,EDU ,Tennessee State University                                      ,Tennessee Louis Stokes Alliance for Minority Participation,"$2,549,230 ",,
1834516,EDU ,Rochester Institute of Tech                                     ,NSF INCLUDES Alliance: Inclusive Graduate Education Network,"$870,298 ",,
1834518,EDU ,Association of Public and Land-Grant Universities               ,Collaborative Research: NSF INCLUDES Alliance: National Alliance for Inclusive  and Diverse STEM Faculty (NAIDSF),"$5,758,764 ",,
1834528,EDU ,University of Southern California                               ,NSF INCLUDES Alliance: Inclusive Graduate Education Network,"$1,338,834 ",,
1834540,EDU ,American Physical Society                                       ,NSF INCLUDES Alliance: Inclusive Graduate Education Network,"$6,752,304 ",,
1834545,EDU ,American Chemical Society (ACS)                                 ,NSF INCLUDES Alliance: Inclusive Graduate Education Network,"$2,355,774 ",,
1839870,ENG ,Harvard University                                              ,FW-HTF: Collaborative Research: The Next Mobile Office: Safe and Productive Work in Automated Vehicles,"$450,000 ",,
1841403,CSE ,Harvard University                                              ,"Phase II I/UCRC Harvard: Center for Spatiotemporal Thinking, Computing and Applications (STCA)","$596,000 ",,
1841687,EDU ,American Association for the Advancement of Science             ,STEM Equity Achievement (SEA Change),"$3,701,729 ",,
1856215,GEO ,Harvard University                                              ,Belmont Forum Collaborative Research: Governance of Sociotechnical Transformations,"$201,124 ",,
1901031,CSE ,Oregon State University                                         ,CHS: Large: Collaborative Research: Gender-Inclusive Open Source through Gender-Inclusive Tools,"$1,006,773 ",,
1906595,EDU ,Exploratorium                                                   ,Cambio: A Professional Development Approach for Building Latinx-focused Cultural Competence in Informal Science Education Institutions,"$2,821,709 ",,
1907398,EDU ,Harvard University                                              ,Collaborative Research: Developing an Online Game to Teach Middle School Students Science Research Practices in the Life Sciences,"$674,805 ",,
1909824,EDU ,Rutgers University Newark                                       ,Louis Stokes STEM Pathways and Research Alliance: Garden State LSAMP,"$4,778,600 ",,
1911251,EDU ,University of Arkansas at Pine Bluff                            ,Louis Stokes STEM Pathways and Research Alliance: ARK-LSAMP,"$3,970,549 ",,
1911271,EDU ,Elmhurst University                                             ,Louis Stokes New STEM Pathways Implementation-Only Alliance: Promotion of Underrepresented Minorities in Academic STEM (PUMA-STEM),"$1,748,109 ",,
1911341,EDU ,Chicago State University                                        ,Louis Stokes STEM Pathways and Research Alliances: The Illinois LSAMP STEM Pathway and Research Alliance (ILSPRA),"$4,695,538 ",,
1914916,MPS ,Harvard University                                              ,The Evolution of Evolvability in Microbial Populations,"$797,669 ",,
1915995,EDU ,Texas Southern University                                       ,The AGEP Data Engineering and Science Alliance Model: Training and Resources to Advance Minority Graduate Students and Postdoctoral Researchers into Faculty Careers,"$376,968 ",,
1916018,EDU ,University of Houston                                           ,The AGEP Data Engineering and Science Alliance Model: Training and Resources to Advance Minority Graduate Students and Postdoctoral Researchers into Faculty Careers,"$388,410 ",,
1916046,EDU ,California State University-Dominguez Hills Foundation          ,The AGEP California State University Underrepresented Minority STEM Faculty Alliance Model: A Culturally-Informed Strengths-Based Approach to Advance Early-Career Faculty Success,"$394,495 ",,
1916050,EDU ,"Cal Poly Pomona Foundation, Inc.                                ",The AGEP California State University Underrepresented Minority STEM Faculty Alliance Model: A Culturally-Informed Strengths-Based Approach to Advance Early-Career Faculty Success,"$422,490 ",,
1916054,EDU ,California State University-Fresno Foundation                   ,The AGEP California State University Underrepresented Minority STEM Faculty Alliance Model: A Culturally-Informed Strengths-Based Approach to Advance Early-Career Faculty Success,"$384,729 ",,
1916056,EDU ,California Polytechnic State University Foundation              ,The AGEP California State University Underrepresented Minority STEM Faculty Alliance Model: A Culturally-Informed Strengths-Based Approach to Advance Early-Career Faculty Success,"$2,112,735 ",,
1916086,EDU ,Bethune-Cookman University                                      ,The AGEP Florida Alliance Model: Improving Minority Women Success in STEM Faculty Careers,"$536,261 ",,
1916093,EDU ,William Marsh Rice University                                   ,The AGEP Data Engineering and Science Alliance Model: Training and Resources to Advance Minority Graduate Students and Postdoctoral Researchers into Faculty Careers,"$1,899,507 ",,
1916094,EDU ,Florida International University                                ,The AGEP Florida Alliance Model: Improving Minority Women Success in STEM Faculty Careers,"$347,449 ",,
1919073,SBE ,Harvard University                                              ,Collaborative research: Emirical Evidence of the Tax Administration Production Function,"$195,153 ",,
1928570,EDU ,Heritage University                                             ,"Culturally Responsive Education in Science, Technology, Engineering, and Mathematics","$2,991,344 ",,
1928622,EDU ,University of Houston - Clear Lake                              ,Building Capacity: Improving STEM Graduation Rates through Engaged Learning,"$2,499,930 ",,
1928693,EDU ,California State University Channel Islands                     ,HSI-SMART: STEM Model for Research and Teaching Undergraduate-intervention Program,"$2,500,000 ",,
1928737,EDU ,Santa Monica College                                            ,Fostering an Equity-minded Student Success Culture in STEM Through Faculty Development,"$2,493,400 ",,
1928740,EDU ,California State University-Dominguez Hills Foundation          ,"Leveraging a Faculty Community of Practice Model of Professional Learning to Enhance Diversity, Equity, and Inclusion in STEM Teaching, Learning, and Leadership","$2,334,801 ",,
1930990,EDU ,University of Pittsburgh                                        ,NSF INCLUDES Alliance: STEM PUSH (Pathways for Underrepresented Students to Higher Education) Network,"$10,000,050 ",,
1935916,EDU ,SUNY College at Geneseo                                         ,ADVANCE Partnership: Council of Public Liberal Arts Colleges Partnering and Liaising Across the Nation,"$883,754 ",,
1936019,EDU ,Washington State University                                     ,ADVANCE Partnership: Values-based Academic Leadership Trajectories for faculty in STEM (VAuLTS),"$1,218,058 ",,
1936075,EDU ,University of North Carolina Greensboro                         ,"ADVANCE Adaptation:  Spartan Adaptations of Best Practices for Faculty Equity, Diversity, and Inclusion at the University of North Carolina at Greensboro (UNCG)","$999,807 ",,
1936144,EDU ,Clarkson University                                             ,"STEM Leadership, Equity, and Advancement for Faculty","$999,934 ",,
1942274,EDU ,Regents of the University of Michigan - Ann Arbor               ,CAREER: An Investigation of Mentors' Practices that Help Minoritized Undergraduates Persist In STEM,"$683,835 ",,
1942438,SBE ,Harvard University                                              ,CAREER: The Tuning and Topography of the Ventral Visual Stream,"$703,757 ",,
1943285,EDU ,"Georgia State University Research Foundation, Inc.              ",CAREER: Black Girl Brilliance and STEM Identity Development,"$1,358,878 ",,
1943902,MPS ,Harvard University                                              ,CAREER: Learning Probabilistic Factor Models,"$400,000 ",,
1953362,EDU ,CSU Fullerton Auxiliary Services Corporation                    ,"Establishing Roots to Grow STEMs: Affirming STEM identity, building community, and improving graduation rates through a multidisciplinary lower division curriculum","$1,442,644 ",,
1953560,EDU ,University of Texas at El Paso                                  ,Developing Engineering Instructional Faculty as Leaders of Educational Change at Hispanic-Serving Institutions,"$1,297,317 ",,
1953586,EDU ,Florida International University                                ,Developing Engineering Instructional Faculty as Leaders of Educational Change at Hispanic-Serving Institutions,"$984,259 ",,
1953606,EDU ,The University of Central Florida Board of Trustees             ,Building Undergraduate Capacity in STEM at a Hispanic Serving Institution utilizing Culturally-Relevant Instruction with Micro-Credentialing,"$1,831,193 ",,
1953631,EDU ,Montclair State University                                      ,"Partnered Internships: Including Families, Faculty, and Industry in STEM Education to Improve Success in STEM Career Pathways","$2,000,000 ",,
1953679,EDU ,Texas A&M International University                              ,Building Capacity: An Undergraduate STEM-Enrichment Program in Texas,"$1,649,197 ",,
1953713,EDU ,San Diego State University Foundation                           ,Mathematics Persistence through Inquiry and Equity: Redeveloping Gateway Mathematics in a Two-year HSI to Promote Success in STEM,"$1,271,684 ",,
1953727,EDU ,California State University-Long Beach Foundation               ,An Active Learning-based Educational Program for Hispanic STEM Students through Industry-University Partnership,"$2,099,874 ",,
1953751,EDU ,Chico State Enterprises                                         ,STEM Course Transformation: Cultivating a Culture of Entrepreneurial Mindset and Undergraduate Research,"$2,200,001 ",,
1953753,EDU ,Southwestern College                                            ,Mathematics Persistence through Inquiry and Equity: Redeveloping Gateway Mathematics in a Two-year HSI to Promote Success in STEM,"$927,073 ",,
1953760,EDU ,San Jose State University Foundation                            ,"Transforming Undergraduate Teaching and Learning Through Culturally Sustaining, Active, and Asset-Based Approaches to Introductory Science Courses","$1,699,833 ",,
1954767,EDU ,Michigan State University                                       ,Collaborative Research: ECR EIE DCL: The Influence of an Inclusive Climate on STEM Academic Early-Career Outcomes,"$541,640 ",,
2000021,EDU ,Michigan State University                                       ,Collaborative Research: ECR EIE DCL: The Development and Validation of a Scale to Assess Epistemic Exclusion in Minoritized and Non-Minoritized STEM Faculty,"$550,194 ",,
2000076,EDU ,University of North Texas                                       ,Collaborative Research: ECR EIE DCL: The Development and Validation of a Scale to Assess Epistemic Exclusion in Minoritized and Non-Minoritized STEM Faculty,"$256,432 ",,
2000448,EDU ,University of New Mexico                                        ,Study of New Strategies to Combat Harassment in Engineering,"$1,199,480 ",,
2000472,EDU ,Ohio State University                                           ,Facilitating Pathways to Success for High-Achieving Pre-Collegiate African American Males in STEM,"$1,498,259 ",,
2000518,EDU ,Regents of the University of Michigan - Ann Arbor               ,Collaborative Research: Recognition of Gender Stereotyping as a Determinant of Stereotype Assimilation and Contrast Effects Resulting from Subtle Bias Exposure in STEM,"$842,676 ",,
2000580,EDU ,Regents of the University of Michigan - Ann Arbor               ,Collaborative Research: ECR EIE DCL: The Development and Validation of a Scale to Assess Epistemic Exclusion in Minoritized and Non-Minoritized STEM Faculty,"$175,011 ",,
2000619,EDU ,TERC Inc                                                        ,"Native STEM Portraits: A Longitudinal, Mixed-Methods Study of the Intersectional Experiences of Native Learners and Professionals in STEM","$1,500,000 ",,
2000769,EDU ,University of Connecticut                                       ,An Examination of How the Lived Experiences of African American Undergraduates Affect their Persistence in their Engineering Programs,"$499,987 ",,
2002771,MPS ,Harvard University                                              ,"Topology, Geometry and Physics","$305,324 ",,
2004710,EDU ,University of Kentucky Research Foundation                      ,"LSAMP BD: University of Kentucky, KY-WV LSAMP","$1,074,997 ",,
2004898,EDU ,University of Arkansas                                          ,LSAMP BD: University of Arkansas ARK-LSAMP,"$1,075,000 ",,
2005475,MPS ,Harvard University                                              ,Geometric Langlands Correspondence: Further Directions,"$210,000 ",,
2008186,EDU ,University of Puerto Rico                                       ,Louis Stokes STEM Pathways and Research Alliance: Puerto Rico-LSAMP - Expanding Opportunities for Underrepresented College Students (2020-2025),"$3,425,079 ",,
2008197,EDU ,Drexel University                                               ,Louis Stokes STEM Pathways and Research Alliance: Greater Philadelphia Region LSAMP (Philadelphia AMP),"$3,799,351 ",,
2008428,EDU ,ALAMO COMMUNITY COLLEGE DISTRICT - St. Philip's College         ,CIMA LSAMP Alliance,"$1,500,000 ",,
2010124,EDU ,North Carolina Agricultural & Technical State University        ,Louis Stokes STEM Pathways and Research Alliance: North Carolina Louis Stokes Alliance for Minority Participation,"$3,200,000 ",,
2010779,EDU ,Morehouse College                                               ,Broadening Participation Research Center: Collaborative Research: Center for Research on Identity and Motivation of African American Students in STEM,"$349,723 ",,
2010846,EDU ,Winston-Salem State University                                  ,Broadening Participation Research Center: Collaborative Research: Center for Research on Identity and Motivation of African American Students in STEM,"$240,095 ",,
2010860,EDU ,Howard University                                               ,Broadening Participation Research Center: Collaborative Research: Center for Research on Identity and Motivation of African American Students in STEM,"$1,648,093 ",,
2011780,MPS ,Chicago State University                                        ,Collaborative Research: Access Expansion: Growing a Network of Equity-Focused Programs in the Physical Sciences,"$35,630 ",,
2011903,EDU ,Fort Valley State University                                    ,Implementation Project: Training of Undergraduates in Genome Engineering and Computational Data Sciences Programs at FVSU,"$2,249,196 ",,
2012023,MPS ,Harvard University                                              ,Physics and Applications of Quantum Nanophotonics Systems,"$2,076,625 ",,
2013874,MPS ,Harvard University                                              ,Spindle Self-Organization and Bioenergetics in Vivo,"$929,916 ",,
2015286,EDU ,Virginia Polytechnic Institute and State University             ,The AGEP Alliance Model for Advancing the Faculty Careers of Underrepresented Minority STEM Doctoral Candidates who are Instructors at Historically Black Universities,"$1,995,977 ",,
2015293,EDU ,Howard University                                               ,An AGEP Historically Black Universities Model with Community College Teaching as a Platform for Advancing Underrepresented Minority STEM Doctoral Candidates in Faculty Careers,"$893,512 ",,
2015313,EDU ,Morgan State University                                         ,An AGEP Historically Black Universities Model with Community College Teaching as a Platform for Advancing Underrepresented Minority STEM Doctoral Candidates in Faculty Careers,"$171,922 ",,
2015316,EDU ,Hampton University                                              ,An AGEP Historically Black Universities Model with Community College Teaching as a Platform for Advancing Underrepresented Minority STEM Doctoral Candidates in Faculty Careers,"$181,850 ",,
2017017,EDU ,University of Washington                                        ,ADVANCE Partnership: AccessADVANCE,"$1,099,206 ",,
2017054,EDU ,North Dakota State University Fargo                             ,ADVANCE Partnership: AccessADVANCE,"$150,001 ",,
2017536,EDU ,Appalachian State University                                    ,ADVANCE Adaptation: ADVANCE Appalachian,"$995,509 ",,
2017704,EDU ,Texas Tech University                                           ,"ADVANCE Adaptation: Advancing Equity through Systemic Strategies to Improve Leadership, Departmental Collegiality, and Data Transparency at Texas Tech University","$976,173 ",,
2017743,EDU ,University of Missouri-Saint Louis                              ,ADVANCE Adaptation: Advancing Equity in STEM Academic Careers through Organizational Change at an Urban Public Research University,"$1,009,066 ",,
2017744,EDU ,University of Arkansas                                          ,ADVANCE Adaptation: University of Arkansas Empowering Networked Groups for Arkansas Gender Equity (ENGAGE),"$1,373,893 ",,
2017802,EDU ,Cleveland State University                                      ,ADVANCE Adaptation: Achieving Excellence and Equity through Academic Leadership Development,"$999,886 ",,
2017953,EDU ,Wepan Inc                                                       ,"ADVANCE Partnership: ACCESS+ Initiative to Leverage STEM Professional Societies to Accelerate Diversity, Equity, and Inclusion Systemic Change in STEM Academic Professions","$1,561,824 ",,
2020491,EDU ,University of Texas at Austin                                   ,Louis Stokes Regional Center of Excellence: Inclusive Mentoring in STEM,"$270,326 ",,
2020524,EDU ,Colorado State University                                       ,Louis Stokes Regional Center of Excellence: Inclusive Mentoring in STEM,"$221,403 ",,
2020548,EDU ,University of Texas at San Antonio                              ,Louis Stokes Regional Center of Excellence: Inclusive Mentoring in STEM,"$187,874 ",,
2020697,EDU ,University of Texas at El Paso                                  ,Louis Stokes Regional Center of Excellence: Inclusive Mentoring in STEM,"$319,306 ",,
