Award ID,Directorate,Recipient,Title,Obligated,,Date of export: 6/5/2025
2233702,BIO ,California State University-Long Beach Foundation               ,Collaborative Research: IMPLEMENTATION: C-COAST: Changing the Culture of our Occupations to Achieve Systemic Transformation,"$31,867 ",,
2233703,BIO ,University of Southern Mississippi                              ,Collaborative Research: IMPLEMENTATION: C-COAST: Changing the Culture of our Occupations to Achieve Systemic Transformation,"$12,121 ",,
2233707,BIO ,BLACK IN MARINE SCIENCE                                         ,Implementation: Implementation of the BIMS Tidal Wave Program,"$1,997,452 ",,
2233787,BIO ,Western Washington University                                   ,"Collaborative Research: IMPLEMENTATION: EVOLVED - Embedding a Vision to Operationalize, Lift up, and Value Equity and Diversity in the Consortium of Aquatic Science Societies","$1,203,675 ",,
2233788,BIO ,SUNY College at Oneonta                                         ,"Collaborative Research: IMPLEMENTATION: EVOLVED - Embedding a Vision to Operationalize, Lift up, and Value Equity and Diversity in the Consortium of Aquatic Science Societies","$88,281 ",,
2233789,BIO ,Clemson University                                              ,"Collaborative Research: IMPLEMENTATION: EVOLVED - Embedding a Vision to Operationalize, Lift up, and Value Equity and Diversity in the Consortium of Aquatic Science Societies","$584,724 ",,
2233790,BIO ,University of Wisconsin-Madison                                 ,"Collaborative Research: IMPLEMENTATION: EVOLVED - Embedding a Vision to Operationalize, Lift up, and Value Equity and Diversity in the Consortium of Aquatic Science Societies","$122,673 ",,
2234308,SBE ,Harvard University                                              ,Evolved changes to neural systems for reactive aggression in humans and other primates,"$342,550 ",,
2234351,SBE ,Society for Personality and Social Psychology                   ,Flourish: A Network for Pre-Tenure Social and Personality Psychologists of Color,"$161,159 ",,
2234510,SBE ,University of Pittsburgh                                        ,SBP: The Role of Apologies in Promoting Intergroup Relations,"$409,197 ",,
2234708,ENG ,Georgia Tech Research Corporation                               ,Planning: BPE TRACK 1: DISRUPTING RACIALIZED PRIVILEGE IN THE STEM CLASSROOM,"$99,791 ",,
2235130,SBE ,Columbia University                                             ,Mechanisms of Facial Stereotyping,"$704,044 ",,
2235579,EDU ,Florida International University                                ,Enhancing Pathways to a STEM Teaching Profession for Students from Minoritized Racial/Ethnic Groups,"$581,978 ",,
2236163,EDU ,University of New Mexico                                        ,"Increasing the Effectiveness of Justice, Equity, Diversity, and Inclusion-Focused Institutional Change Teams through a Community of Transformation","$609,429 ",,
2236374,EDU ,Arizona State University                                        ,"Increasing the Effectiveness of Justice, Equity, Diversity, and Inclusion-Focused Institutional Change Teams through a Community of Transformation","$590,387 ",,
2236596,SBE ,William Marsh Rice University                                   ,"CAREER: Broadening Participation in Resilience Education, Research, and Practice by Leveraging Organizational Resources to Address Racial Identity Threats","$242,919 ",,
2236618,CSE ,University of Washington                                        ,CAREER: Tools for User and Community-Led Social Media Curation,"$246,746 ",,
2236814,SBE ,University of Arkansas                                          ,Clarifying the Role of Inflammation in Social Prejudice,"$199,974 ",,
2237151,EDU ,James Madison University                                        ,CAREER: Preparing Middle and High School Pre-service Teachers for Critical Mathematics Education,"$322,800 ",,
2237461,SBE ,Purdue University                                               ,"SBP: CAREER: Mechanistic Dehumanization of Asians: Identifying Causes, Consequences, and Countermeasures for a More Inclusive STEM Workforce","$721,716 ",,
2237564,ENG ,Florida International University                                ,CAREER: Using Equity Metrics and Reflective Engagement to Transform Engineering Classrooms Towards Racial Equity,"$323,674 ",,
2237580,SBE ,Trustees of Boston University                                   ,"CAREER: Mass Incarceration, Racial Segregation, and Spillover Effects in U.S. Communities","$231,958 ",,
2237739,EDU ,Michigan State University                                       ,CAREER: Developing a Participatory Model for Elementary Science for Community Change,"$227,694 ",,
2237867,ENG ,University of Houston                                           ,CAREER: Centering the Engineering Identity of Black Men to Enhance Representation and Degree Completion,"$282,660 ",,
2237986,EDU ,Texas State University - San Marcos                             ,CAREER: Affirming Bilingual Children’s Participation in Mathematics,"$373,409 ",,
2238071,BIO ,Harvard University                                              ,CAREER: Integrating brain-behavior evolution with real-world science impacts through neuroscience of working dogs,"$925,967 ",,
2238113,MPS ,Harvard University                                              ,CAREER: Manipulating Barocaloric Effects in Two-Dimensional Perovskites,"$479,118 ",,
2238389,CSE ,University of South Florida                                     ,CAREER: Inclusive Cybersecurity Through the Lens of Accessible Identity and Access Management,"$271,190 ",,
2238410,ENG ,Regents of the University of Michigan - Ann Arbor               ,CAREER: Learning from Black Intellectualism: Broadening Epistemic Foundations in Engineering Education to Empower Black Students and Faculty,"$153,285 ",,
2238446,EDU ,Michigan State University                                       ,"CAREER: Family Support, Pressure, Disengagement, and Marginalization: Facilitating or Hindering STEM Interest and Career Participation among Diverse Women","$501,215 ",,
2238714,CSE ,Harvard University                                              ,Career: Towards a Systematic Characterization of Model Explanations for High-Stakes Decision Making,"$211,592 ",,
2238836,CSE ,Harvard University                                              ,"CAREER: Complexity of quantum many-body systems: learnability, approximations, and entanglement","$296,815 ",,
2239021,CSE ,University of Georgia Research Foundation Inc                   ,CAREER: When Two Worlds Collide: An Intersectional Analysis of Black Women's Role Strain and Adaptation in Computing Sciences,"$244,095 ",,
2239067,SBE ,University of California-Riverside                              ,CAREER: Ethnic-racial discrimination influences on neural representation of threat learning in Latina girls: A multivariate modeling approach,"$481,485 ",,
2239194,CSE ,"University of Maryland, College Park                            ",CAREER: Socio-Algorithmic Foundations of Trustworthy Recommendations,"$429,788 ",,
2239234,MPS ,Harvard University                                              ,CAREER: Statistical Inference in High Dimensions using Variational Approximations,"$169,860 ",,
2239242,GEO ,Harvard University                                              ,CAREER: Using Tracer Interrelationships to Understand Large-Scale Geophysical Flows and their Changes,"$946,343 ",,
2239348,ENG ,Tufts University                                                ,CAREER: BLACK-LATINX RESOURCES IN COMMUNITY-LED ENGINEERING: INVESTIGATING THE ROLE OF LANGUAGE AND CULTURE,"$177,067 ",,
2239780,CSE ,Harvard University                                              ,CAREER: Developing Neural Network Theory for Uncovering How the Brain Learns,"$602,466 ",,
2239795,MPS ,Harvard University                                              ,CAREER: Towards Particle Physics Discoveries With Double Cascades In IceCube and Beyond,"$557,803 ",,
2239824,ENG ,Massachusetts Institute of Technology                           ,CAREER: Advancing Equity in Selection Problems Through Bias-Aware Optimization,"$531,915 ",,
2239879,CSE ,Georgia Tech Research Corporation                               ,"CAREER: Social Response-Powered Misinformation Detection, Robustness, and Correction","$120,008 ",,
2240327,CSE ,Auburn University                                               ,Collaborative Research: EAGER: Intersectional Computing,"$204,324 ",,
2240343,SBE ,Regents of the University of Michigan - Ann Arbor               ,Constructing Credible Knowledge and Expertise in Air Pollution Regulation and Monitoring: The Problem of Quantification,"$15,598 ",,
2240535,SBE ,Tufts University                                                ,SPARKing Representation in Cognitive Science,"$239,553 ",,
2240660,SBE ,University of Colorado at Boulder                               ,Standard Research Grant: Explaining Variations and Social Outcomes of Cumulative Impact Assessment for Environmental Justice by Government Agencies in Environmental Permit Review,"$436,156 ",,
2240900,SBE ,Columbia University                                             ,DDRIG: Intimate Crises: The history of notions of sexuality and gender in the 19th and 20th century,"$15,070 ",,
2241068,CSE ,Illinois Institute of Technology                                ,"Collaborative Research: SaTC: CORE: Small: Targeting Challenges in Computational Disinformation Research to Enhance Attribution, Detection, and Explanation","$224,033 ",,
2241069,CSE ,University of California-Santa Barbara                          ,"Collaborative Research: SaTC: CORE: Small: Targeting Challenges in Computational Disinformation Research to Enhance Attribution, Detection, and Explanation","$155,967 ",,
2241070,CSE ,Syracuse University                                             ,"Collaborative Research: SaTC: CORE: Small: Targeting Challenges in Computational Disinformation Research to Enhance Attribution, Detection, and Explanation","$220,000 ",,
2241521,SBE ,National Bureau of Economic Research Inc                        ,Collaborative Research: Southern Lynchings and Children's Educational Outcomes,"$201,410 ",,
2241522,SBE ,Mississippi State University                                    ,Collaborative Research: Southern Lynchings and Children's Educational Outcomes,"$103,735 ",,
2241576,EDU ,University of California-Berkeley                               ,AI for the Workforce of Tomorrow: Attending to Ethics and Collaboration in Learning Artificial Intelligence for High School Aged Youth,"$1,291,633 ",,
2241596,EDU ,University of California-Irvine                                 ,Equity-Centered Design of Conversational Agents for Inclusive Science Communication Education in High Schools,"$499,801 ",,
2241805,EDU ,University of California-Berkeley                               ,Supporting Rightful Presence in Museum Spaces: Youth as Participatory Designers of Indigenous Mixed Reality Science Exhibits,"$1,391,279 ",,
2241828,SBE ,United States Air Force Academy                                 ,Collaborative Research: The Militarized Dispute Data 2015-2024 and Beyond,"$20,672 ",,
2241885,SBE ,Harvard University                                              ,"Collaborative Research: State Health, Institutions, and Politics Survey (SHIPS)","$332,169 ",,
2242057,SBE ,Princeton University                                            ,Daily Watcher Tracking Survey and Monitoring the Effects of War on Public Opinion,"$497,624 ",,
2242643,ENG ,Louisiana State University                                      ,Toward Equitable Power Infrastructure Resilience,"$363,852 ",,
2242654,EDU ,University of Nevada Las Vegas                                  ,CAREER: Partnering with Teachers and Students to Engage in Mathematical Inquiry about Relevant Social Issues,"$719,417 ",,
2242927,BIO ,University of Illinois at Chicago                               ,RCN-UBE: Deepening and Expanding the Mission and Outcomes of the Re-Envisioning Culture Network,"$500,000 ",,
2243017,EDU ,University of Texas at Arlington                                ,"AGEP FC-PAM: The University of Texas System Alliance: An Inclusive Model of Mentoring, Sponsorship, and Systemic Change for Diversity in STEM Faculty Career Paths","$1,077,608 ",,
2243018,EDU ,University of Texas at El Paso                                  ,"AGEP FC-PAM: The University of Texas System Alliance: An Inclusive Model of Mentoring, Sponsorship, and Systemic Change for Diversity in STEM Faculty Career Paths","$245,140 ",,
2243020,EDU ,University of Texas at San Antonio                              ,"AGEP FC-PAM: The University of Texas System Alliance: An Inclusive Model of Mentoring, Sponsorship, and Systemic Change for Diversity in STEM Faculty Career Paths","$103,224 ",,
2243041,SBE ,Educational Testing Service                                     ,Statistical and Psychometric Methods for Measuring the Extent to Which Culturally Responsive Assessments Reduce Cultural Bias,"$360,000 ",,
2243105,EDU ,Brown University                                                ,AGEP FC-PAM: Alliance for Relevant and Inclusive Sponsorship of Engineering Researchers (ARISE) to Increase the Diversity of the Biomedical Engineering Faculty,"$810,124 ",,
2243106,EDU ,Johns Hopkins University                                        ,AGEP FC-PAM: Alliance for Relevant and Inclusive Sponsorship of Engineering Researchers (ARISE) to Increase the Diversity of the Biomedical Engineering Faculty,"$253,293 ",,
2243107,EDU ,Yale University                                                 ,AGEP FC-PAM: Alliance for Relevant and Inclusive Sponsorship of Engineering Researchers (ARISE) to Increase the Diversity of the Biomedical Engineering Faculty,"$253,213 ",,
2243108,EDU ,Columbia University                                             ,AGEP FC-PAM: Alliance for Relevant and Inclusive Sponsorship of Engineering Researchers (ARISE) to Increase the Diversity of the Biomedical Engineering Faculty,"$226,487 ",,
2243109,EDU ,University of Illinois at Chicago                               ,Examining Blackness in Postsecondary STEM Education through a Multidimensional-Multiplicative Lens,"$2,781,881 ",,
2243466,EDU ,Bank Street College of Education                                ,Growing Teacher Leadership in Mathematics for Underserved Schools,"$1,117,403 ",,
2243704,BIO ,Harvard University                                              ,Collaborative Research: Ideas Lab: Discovery of Novel Functional RNA Classes by Computational Integration of Massively-Parallel RBP Binding and Structure Data,"$932,563 ",,
2243724,MPS ,Harvard University                                              ,Photoactivation of Stable Bonds for Chemical Conversions,"$700,000 ",,
2243733,GEO ,East Central University                                         ,"MS PHD'S Access, Inclusion, and Mentoring (AIM) in Geosciences Program","$164,796 ",,
2243822,EDU ,University of California-Berkeley                               ,"NRT-HDR: Computational Research for Equity in the Legal System"" (CRELS)","$3,000,000 ",,
2243905,SBE ,University of Memphis                                           ,Collaborative Research: Uncovering and Enhancing Pathways to Psychological Safety at Work for Racial Minority Women,"$148,020 ",,
2243906,SBE ,University of Houston                                           ,Collaborative Research: Uncovering and Enhancing Pathways to Psychological Safety at Work,"$251,981 ",,
2243912,MPS ,Georgetown University                                           ,REU SITE: Summer Program Advancing Techniques in the Applied Learning of Statistics (SPATIAL-Stats) at Georgetown University,"$230,198 ",,
2243983,SBE ,Hofstra University                                              ,"RUI: Relationship crafting after workplace ostracism in racial minority employees: The role of autonomic arousal, emotions, and cognitive attributions","$400,000 ",,
2244144,ENG ,University of Pittsburgh                                        ,REU Site: FIRE: Facilitating Inclusive Research Experiences in Mechanical Engineering and Materials Science,"$410,216 ",,
2244231,SBE ,Texas A&M University                                            ,NSF REU Site: Research in Social Inequality and Social Problems,"$366,046 ",,
2244271,CSE ,Georgetown University                                           ,REU SITE: From Formal Computer Science Education to Real World Data Science Research to Policy Decision Making,"$458,164 ",,
2244380,SBE ,University of South Florida                                     ,REU Site: Interdisciplinary Approaches to Environmental Adaptation,"$428,885 ",,
2244734,SBE ,University of Missouri-Columbia                                 ,WTG: Diffusion of Research on Supporting Mathematics Achievement for Youth with Disabilities through Twitter Translational Visual Abstracts,"$311,844 ",,
2245181,EDU ,University of California-Irvine                                 ,ADVANCE Partnership: Strategic Partnership for Alignment of Community Engagement in STEM (SPACES),"$79,403 ",,
2245246,MPS ,Harvard University                                              ,Strange metals and the phases of quantum materials,"$495,000 ",,
2245648,GEO ,SUNY Empire State College                                       ,GP-IN: Communities Of Aquatic Sciences in Teaching And Learning (COASTAL) Research Partnerships for Equity,"$327,850 ",,
2246079,CSE ,Northeastern University                                         ,CUE-M: LEVEL UP: Charting a Pathway toward Inclusive Computing,"$1,000,000 ",,
2246599,EDU ,New Mexico State University                                     ,"H.S.I. Institutional Transformation Project: NMSU-MAS, Mejorando las Aulas en STEM/Improving STEM Classrooms","$1,054,684 ",,
2246607,EDU ,Regents of the University of Michigan - Ann Arbor               ,"Advancing, Supporting, and Sustaining Equity among Elementary Teachers of Science","$1,181,311 ",,
2246630,MPS ,Harvard University                                              ,Bifurcations in Complex Algebraic Dynamics,"$446,934 ",,
2246746,MPS ,Harvard University                                              ,Classification and invariants for Borel equivalence relations,"$163,146 ",,
2246957,EDU ,Marymount University                                            ,PROJECT DREAM:  Diversity Recruited into Engineering through Advanced Making,"$199,996 ",,
2247071,ENG ,Colorado School of Mines                                        ,Collaborative Research: Planning: Track 1 for Catalyzing a Paradigm Shift towards an Inclusive Engineering for Community Development,"$37,405 ",,
2247494,MPS ,Harvard University                                              ,Screening for Generality in Asymmetric Catalysis,"$575,000 ",,
2247530,EDU ,Texas A&M International University                              ,HSI Pilot Project: Investigating Impact of an Active Learning-informed and Creative-Video-based Psychosocial Enrichment Intervention on Retention of Hispanic Engineering Students,"$200,000 ",,
2247636,EDU ,"Loyola University Maryland, Inc.                                ",Latinas Resistance Behaviors in Engineering Programs at Predominantly White Institutions (PWIs) and Hispanic Serving Institutions (HSIs): An Intersectional View,"$498,271 ",,
2247646,EDU ,The University of Texas Rio Grande Valley                       ,"Collaborating with Student Partners to Design, Implement, and Assess Equity-Minded and Research-Based Teaching and Learning Practices in Mathematics Undergraduate Courses","$199,838 ",,
2247670,EDU ,Azusa Pacific University                                        ,HSI Pilot Project: Impact of Learning Assistants on STEM Identity for Students Historically Underrepresented in STEM,"$199,991 ",,
2247817,MPS ,Harvard University                                              ,CAS: Collaborative Research: Electronic Structure/Function Relationships Underpinning Atom Transfer Reactivity,"$361,035 ",,
2247858,EDU ,City Colleges of Chicago Harry S Truman College                 ,Truman and UChicago Data Science Preceptors Track II,"$999,891 ",,
2247867,CSE ,SUNY at Binghamton                                              ,Collaborative Research: SaTC: TTP: Medium: iDRAMA.cloud: A Platform for Measuring and Understanding Information Manipulation,"$505,017 ",,
2247868,CSE ,Trustees of Boston University                                   ,Collaborative Research: SaTC: TTP: Medium: iDRAMA.cloud: A Platform for Measuring and Understanding Information Manipulation,"$225,669 ",,
2247928,EDU ,Sam Houston State University                                    ,HSI Institutional Transformation Project: Building Community Success through Institutionalized and Culturally Responsive Support Systems,"$891,547 ",,
2247959,CSE ,Tufts University                                                ,SaTC: CORE: Small: Understanding and Reducing Barriers to Entry and Participation in the Vulnerability Discovery Community,"$599,999 ",,
2300164,EDU ,Michigan State University                                       ,Collaborative Research: Increasing Inclusion and Equity of Minoritized STEM Faculty: Examining the Role of Epistemic Exclusion in Scholar(ly) Evaluation Practices,"$584,383 ",,
2300165,EDU ,University of North Texas                                       ,Collaborative Research: Increasing Inclusion and Equity of Minoritized STEM Faculty: Examining the Role of Epistemic Exclusion in Scholar(ly) Evaluation Practices,"$173,474 ",,
2300166,EDU ,Regents of the University of Michigan - Ann Arbor               ,Collaborative Research: Increasing Inclusion and Equity of Minoritized STEM Faculty: Examining the Role of Epistemic Exclusion in Scholar(ly) Evaluation Practices,"$649,931 ",,
2300380,EDU ,Columbia University                                             ,ADVANCE Partnership: New Jersey Equity in Commercialization Collective (NJECC),"$1,118,016 ",,
2300607,EDU ,Florida International University                                ,Collaborative Research: Mobilizing Physics Teachers to Promote Inclusive and Communal Classroom Cultures through Everyday Actions,"$1,321,338 ",,
2300608,EDU ,American Physical Society                                       ,Collaborative Research: Mobilizing Physics Teachers to Promote Inclusive and Communal Classroom Cultures through Everyday Actions,"$925,207 ",,
2300609,EDU ,American Association of Physics Teachers                        ,Collaborative Research: Mobilizing Physics Teachers to Promote Inclusive and Communal Classroom Cultures through Everyday Actions,"$249,966 ",,
2300927,EDU ,San Diego State University Foundation                           ,Support Partnership for New Bilingual Science and Engineering Teachers,"$1,202,028 ",,
2301114,EDU ,University of Kentucky Research Foundation                      ,Collaborative Research: Examining the Longitudinal Development of Pre-Service Elementary Teachers’ Equitable Noticing of Children’s Mathematical Thinking,"$406,865 ",,
2301115,EDU ,University of Texas at San Antonio                              ,Collaborative Research: Examining the Longitudinal Development of Pre-Service Elementary Teachers’ Equitable Noticing of Children’s Mathematical Thinking,"$158,787 ",,
2301116,EDU ,"Georgia State University Research Foundation, Inc.              ",Collaborative Research: Examining the Longitudinal Development of Pre-Service Elementary Teachers’ Equitable Noticing of Children’s Mathematical Thinking,"$135,612 ",,
2301180,EDU ,Harvard University                                              ,Cognitive Mechanisms of Guided Instruction in the Early Elementary Years,"$1,031,634 ",,
2301196,EDU ,SUNY at Buffalo                                                 ,Collaborative Research: Using Complex Systems Theory and Methods to Gauge the Gains and Persisting Challenges of Broadening Participation Initiatives,"$297,281 ",,
2301197,EDU ,Rowan University                                                ,Collaborative Research: Using Complex Systems Theory and Methods to Gauge the Gains and Persisting Challenges of Broadening Participation Initiatives,"$202,680 ",,
2301246,EDU ,Harvard University                                              ,Collaborative Research: Promoting Math Skills through Playful Communication in the Home Environment,"$216,238 ",,
2301247,EDU ,University of California-Irvine                                 ,Collaborative Research: The Smart Playground: Computational Thinking through Robotics in Early Childhood,"$1,199,793 ",,
2301248,EDU ,Boston College                                                  ,Collaborative Research: The Smart Playground: Computational Thinking through Robotics in Early Childhood,"$522,638 ",,
2301249,EDU ,Tufts University                                                ,Collaborative Research: The Smart Playground: Computational Thinking through Robotics in Early Childhood,"$524,970 ",,
2301964,O/D ,Arizona State University                                        ,AccelNet-Design: Global Futures Oriented Research Collective on Education for Sustainability (G-FORCES),"$250,000 ",,
2302773,EDU ,University of Texas at Austin                                   ,Collaborative Research: Developing and Researching K-12 Teacher Leaders Enacting Anti-bias Mathematics Education,"$585,290 ",,
2303074,EDU ,Florida Gulf Coast University                                   ,"ADVANCE Catalyst: Reveal, Amplify, and Implement Strategies for Equity (RAISE)","$297,013 ",,
