Award ID,Directorate,Recipient,Title,Obligated,,Date of export: 6/5/2025
2327599,CSE ,Smith College                                                   ,Travel: Workshop for Women in Machine Learning,"$49,900 ",,
2328610,EDU ,University of Utah                                              ,Postdoctoral Training Program to Develop Critical Research Skills,"$648,784 ",,
2329343,EDU ,University of Puerto Rico-Rio Piedras                           ,CREST-PRP: Ecohydrology in the Anthropocene: Hydrometeorological Controls of Physical and Biogeochemical Processes in Chronically Stressed Ecosystems,"$338,255 ",,
2329394,CSE ,Rutgers University New Brunswick                                ,HCC: Small: Incorporating Procedural Fairness in Flagging Mechanisms on Social Media Sites,"$581,680 ",,
2329420,CSE ,University of Washington                                        ,WORKSHOP: WiGRAPH - Women in Graphics Research 2023,"$44,360 ",,
2329425,TIP ,LISA FITZPATRICK & ASSOCIATES MD PC                             ,SBIR Phase II:  HealthText: Providing digital healthcare navigation for underserved communities in the US,"$999,904 ",,
2329538,EDU ,Clemson University                                              ,PROMISE: Postdoctoral Research Opportunities and Mentoring for Inclusive STEM Education,"$1,444,001 ",,
2329570,EDU ,"Georgia State University Research Foundation, Inc.              ",A Postdoctoral Fellowship in Systematic Reviews and Meta-Analyses,"$1,207,522 ",,
2330015,EDU ,Northwestern University                                         ,Inclusive Graduate Programs: An AGEP Pilot in Physics,"$670,152 ",,
2330332,SBE ,"University of Maryland, College Park                            ","Collaborative Research: The Role of Elites, Organizations, and Movements in Reshaping Politics and Policymaking","$196,240 ",,
2330886,GEO ,Montana State University                                        ,Doctoral Dissertation Research: Fertility and Reproductive Health Decisions in Response to Climate Change and Adaptation in Greenland,"$58,000 ",,
2330910,EDU ,Education Development Center                                    ,Conference: Envisioning STEM Education for the Green and Blue Economies,"$99,873 ",,
2330922,GEO ,Syracuse University                                             ,"Collaborative Research: Indigenous Northern Landscapes, Visual Repatriation, and Collaborative Knowledge Exchange","$424,332 ",,
2330923,GEO ,University of Alaska Fairbanks Campus                           ,"Collaborative Research: Indigenous Northern Landscapes, Visual Repatriation, and Collaborative Knowledge Exchange","$214,931 ",,
2330924,GEO ,University of Colorado at Boulder                               ,"Collaborative Research: Indigenous Northern Landscapes, Visual Repatriation, and Collaborative Knowledge Exchange","$131,932 ",,
2330963,EDU ,Johnson C. Smith University                                     ,Broadening Participation Research Project: The Development of a Multidimensional STEM Identity Measure to Increase the Retention and Success of African American Students at an HBCU,"$280,944 ",,
2331010,ENG ,San Diego State University Foundation                           ,BPE Track 1: Planning: Foundational Mathematics for Engineers at San Diego State University,"$99,985 ",,
2331066,CSE ,Ohio State University                                           ,CAREER: Cracking the Diversity Code: Understanding Computing Pathways of those Least Represented,"$296,209 ",,
2331116,EDU ,Oregon Museum of Science and Industry                           ,Planning: FIRE-PLAN: Wildland Fire + Cultural Burning (WFCB),"$99,055 ",,
2331195,TIP ,PUBLIC POLICY LAB                                               ,Compass Pilot,"$2,109,800 ",,
2331216,TIP ,Columbus State Community College                                ,Collaborative Research: EPIIC: Expanding Team Capacity for High Impact and New Growth (ETCHING) Cohort,"$400,000 ",,
2331217,TIP ,SUNY Onondaga Community College                                 ,Collaborative Research: EPIIC: Expanding Team Capacity for High Impact and New Growth (ETCHING) Cohort,"$400,000 ",,
2331228,BIO ,Harvard University                                              ,EAGER: Identifying the genetic determinants of plasmid-dependent phage host range,"$300,000 ",,
2331287,TIP ,Council of Graduate Schools                                     ,Expanding Access to Graduate Education and the Advanced STEM Workforce,"$1,169,896 ",,
2331317,EDU ,West Chester University of Pennsylvania                         ,ADVANCE Catalyst: Lead & Accelerate University Change for STEM Faculty at West Chester University (LAUnCh STEM at WCU),"$299,997 ",,
2331458,TIP ,Illinois Institute of Technology                                ,ART: Illinois Tech Forward Initiative,"$6,000,000 ",,
2331831,CSE ,Harvard University                                              ,SLES: A Theoretical Lens on Generative AI Safety: Near and Long Term,"$800,000 ",,
2331874,EDU ,University of Georgia Research Foundation Inc                   ,Planning: FIRE-PLAN:Convergent Pyroscapes: Catalyzing Innovative and Inclusive Wildland Fire Science and Education in Western North Carolina,"$196,799 ",,
2332102,ENG ,University of Wisconsin-Madison                                 ,"Support for Student Teams to Participate in International Challenge at Annual Conference of American Society of Precision Engineering; Boston, Massachusetts; 13-18 November 2023","$31,800 ",,
2332232,MPS ,Morehouse College                                               ,PRIMES: Researching and Teaching Mathematics of Fairness and Equity,"$365,861 ",,
2332263,ENG ,University of California-Irvine                                 ,CLIMA/Collaborative Research: Equitable Adaptive Strategies for Flood Protection Infrastructure under Current and Future Compound Hazards,"$325,267 ",,
2332539,MPS ,Harvard University                                              ,EAGER: Coherent Manipulation and Quantum Entanglement in Ultracold Reactions,"$300,000 ",,
2332592,MPS ,University of Minnesota-Twin Cities                             ,Conference: Gender Equity in the Mathematical Study (GEMS) of Commutative Algebra,"$20,000 ",,
2332668,MPS ,Harvard University                                              ,Collaborative Research: SWIFT-SAT: Coexistence of Remote Astronomical Instruments Susceptible to Interference with Large Communication Satellite Constellations,"$259,284 ",,
2332699,EDU ,Florida International University                                ,Planning: Building a Digital Twin-Based Virtual Engineering Laboratory for Students with Disabilities,"$100,000 ",,
2332964,EDU ,University of Georgia Research Foundation Inc                   ,"Conference: Advancing AI in Science Education (AASE): A Comprehensive Approach to Equity, Inclusion, and Three-Dimensional Learning","$99,821 ",,
2333014,BIO ,Harvard University                                              ,Rehousing and Digitization of the Museum of Comparative Zoology Recent Invertebrate Microscope Slide Collections,"$639,620 ",,
2333261,GEO ,"The Geological Society of America, Inc.                         ",Collaborative Research: Utilizing Professional Societies to Achieve a Reinforcing Transformative Culture (UPSTART Culture),"$1,561,546 ",,
2333262,GEO ,University of Texas at Austin                                   ,Collaborative Research: Utilizing Professional Societies to Achieve a Reinforcing Transformative Culture (UPSTART Culture),"$351,684 ",,
2333270,ENG ,William Marsh Rice University                                   ,"Workshop on Engineering Innovation for Health; Houston, Texas; 2024","$10,000 ",,
2333466,MPS ,Harvard University                                              ,EAGER: Collaborative K-12 Outreach at the Interface between Biology and Imaging Science,"$299,942 ",,
2333494,BIO ,University of Southern California                               ,RAPID: Retrospective COVID-19 Scenario Projections Accounting for Population Heterogeneities,"$195,825 ",,
2333737,TIP ,Georgia Tech Research Corporation                               ,Proto-OKN Theme 1 CollabNext: A Person-Focused Metafabric for Open Knowledge Networks,"$1,365,875 ",,
2333740,TIP ,University of Virginia Main Campus                              ,Proto-OKN Theme 1: A Dynamically-Updated Open Knowledge Network for Health: Integrating Biomedical Insights with Social Determinants of Health,"$1,500,000 ",,
2333790,TIP ,Purdue University                                               ,Proto-OKN Theme 1: A Knowledge Graph Warehouse for Neighborhood Information,"$1,500,000 ",,
2333888,BIO ,Harvard University                                              ,Collaborative Research: NSF-BSF: Under Pressure: The evolution of guard cell turgor and the rise of the angiosperms,"$500,555 ",,
2333904,MPS ,Harvard University                                              ,EAGER: Researching Team-Based Learning in High-School Physics Classes,"$300,000 ",,
2333959,EDU ,University of Georgia Research Foundation Inc                   ,CAREER: Equity Focused Elementary Mathematics:  Creating Virtual Mathematics Communities in Rural Georgia,"$346,897 ",,
2333985,GEO ,National Academy of Sciences                                    ,"Increasing Diversity, Equity, Inclusion, Belonging, Accessibility and Justice (DEIBAJ) in the US Ocean Studies Community","$280,000 ",,
2334059,BIO ,Michigan State University                                       ,Conference: Rustbelt RNA Meeting 2023-2025,"$50,000 ",,
2334206,GEO ,University of Arkansas                                          ,Collaborative Research: Travel: Geosciences United - A joint Technical Conference of the National Association of Black Geoscientists and the American Geophysical Union,"$71,250 ",,
2334272,SBE ,University of Georgia Research Foundation Inc                   ,Planning: CRISES: Collaborative Research and Education Center for Transformative Water Solutions,"$100,000 ",,
2334298,SBE ,University of Tennessee Knoxville                               ,"Planning: CRISES: Southeast Center for Just, Resilient, and Sustainable Ecosystems (SECURE)","$100,000 ",,
2334313,EDU ,University of Cincinnati Main Campus                            ,EAGER: Exploring Customized STEM Employment Approaches for People with Disabilities,"$300,000 ",,
2334340,SBE ,University of California-Santa Barbara                          ,Planning: CRISES: Climate Adaptation Solutions Accelerator (CASA) through School-Community Hubs,"$99,098 ",,
2334406,EDU ,Association of American Colleges and Universities               ,A Knowledge Management Resource Center for the Historically Black Colleges and Universities – Undergraduate Program,"$3,127,229 ",,
2334638,EDU ,Claremont Graduate University                                   ,Becoming a Scientist: A Study of Identity Balance and the Persistence of Hispanic Undergraduate Students in Engineering and Biological Sciences,"$533,666 ",,
2334679,BIO ,Federation of Amer Societies For Exper Biology                  ,DESIGN: Driving Culture Change in a Federation of Biological Societies via Cohort-Based Early-Career Leaders,"$499,568 ",,
2334832,BIO ,Chapman University                                              ,DESIGN: Reforming organizational culture across Biology using a Community of Care framework,"$494,256 ",,
2334882,CSE ,Harvard University                                              ,Collaborative Research: Artificially-Evolved Modular Robotic Swimmers for Enhanced Mobility in Challenging Hydrodynamic Environments,"$302,687 ",,
2334951,BIO ,University of Alabama at Birmingham                             ,Collaborative Research: IMPLEMENTATION: Broadening participation of marginalized individuals to transform SABER and biology education,"$1,274,120 ",,
2334952,BIO ,Arizona State University                                        ,Collaborative Research: IMPLEMENTATION: Broadening participation of marginalized individuals to transform SABER and biology education,"$206,492 ",,
2334953,BIO ,University of North Georgia                                     ,Collaborative Research: IMPLEMENTATION: Broadening participation of marginalized individuals to transform SABER and biology education,"$138,184 ",,
2334954,BIO ,University of California - Merced                               ,Collaborative Research: IMPLEMENTATION: Broadening participation of marginalized individuals to transform SABER and biology education,"$81,069 ",,
2334955,BIO ,Florida International University                                ,Collaborative Research: IMPLEMENTATION: Broadening participation of marginalized individuals to transform SABER and biology education,"$143,926 ",,
2334964,BIO ,Allegheny College                                               ,DESIGN: Creating cultural change in small to medium-sized professional societies: a training network approach,"$448,575 ",,
2334984,BIO ,Harvard University                                              ,DESIGN: Culture Change - Building a Relational and Inclusive Discipline through Genetics Engagement (CC-BRIDGE),"$499,957 ",,
2335206,TIP ,PHARMACOUSTICS TECHNOLOGIES LLC                                 ,"STTR Phase II: Ultrasonic Product Release-Testing Equipment for the Design, Development, and Advanced Continuous Manufacturing of Pharmaceutical Tablets","$997,734 ",,
2335225,BIO ,University of Arkansas                                          ,IMPLEMENTATION: Shifting Culture and Mitigating Inequities in Landscape Ecology Through a Collaborative Network of Professional Societies,"$1,359,303 ",,
2335235,BIO ,California State University-Fresno Foundation                   ,"Collaborative Research: Design: Strengthening Inclusion by Change in Building Equity, Diversity and Understanding (SICBEDU) in Integrative Biology","$443,813 ",,
2335236,BIO ,University of California - Merced                               ,"Collaborative Research: Design: Strengthening Inclusion by Change in Building Equity, Diversity and Understanding (SICBEDU) in Integrative Biology","$29,017 ",,
2335532,TIP ,CLAUDIUS LEGAL INTELLIGENCE INC                                 ,SBIR Phase II: Artificial Intelligence Tool for Analysis of Legal Documents,"$947,862 ",,
2335901,EDU ,The Texas A&M University System HSC                             ,"CAREER: Stress, Resilience, and Persistence Factors that Impact Success of LGBTQ Undergraduate Students in STEM","$200,642 ",,
2336044,GEO ,Harvard University                                              ,CAREER: Habitability of the Hadean Earth - A South African perspective,"$330,221 ",,
2336484,TIP ,Council of Graduate Schools                                     ,"Broadening Participation in STEM Graduate Degrees and the U.S. STEM Workforce:  Understanding Application, Admissions, And Matriculation in STEM Graduate Education","$4,662,695 ",,
2336572,SBE ,Ohio State University                                           ,Doctoral Dissertation Research: Determinants of social meaning,"$18,760 ",,
2336806,SBE ,Washington University                                           ,"CAREER: Thriving in Context: Bridging Academic, Social, and Psychological Wellbeing among Black College Women to Increase STEM Retention (Broadening Participation and Persistence)","$384,032 ",,
2336815,SBE ,Washington University                                           ,Collaborative Research: Socialization Competencies and Youth Outcomes in Response to Racial Violence,"$211,350 ",,
2337063,EDU ,Auburn University                                               ,Collaborative Research: Sharing Scientist Role Model Stories to Improve Equity and Success in Undergraduate STEM Education,"$942,952 ",,
2337064,EDU ,Michigan State University                                       ,Collaborative Research: Sharing Scientist Role Model Stories to Improve Equity and Success in Undergraduate STEM Education,"$555,943 ",,
2337293,SBE ,University of Nebraska-Lincoln                                  ,CAREER: Equitable Access to Justice: Determinants of Engagement with the Civil Justice System,"$446,388 ",,
2337516,SBE ,Harvard University                                              ,Doctoral Dissertation Research: Investigating the genomic underpinnings of the human hand and foot,"$42,250 ",,
2338206,MPS ,Harvard University                                              ,CAREER: CAS: Organic Photochemistry for Light-Driven CO2 Capture and Release,"$770,000 ",,
2338556,ENG ,University of Arizona                                           ,CAREER: Addressing Flood Justice and Equity Impacts of Adaptation and Urban Expansion with Satellite Observations,"$550,254 ",,
2338735,EDU ,University of Nevada Las Vegas                                  ,"CAREER: Identifying, Enabling, and Supporting Racial Justice in Science Teaching","$455,036 ",,
2338760,MPS ,Harvard University                                              ,"CAREER: Statistical Inference in Observational Studies -- Theory, Methods, and Beyond","$81,885 ",,
2339090,EDU ,University of California-San Diego                              ,CAREER: Exploring STEM Identity Formation of Black Undergraduate Students through Transdisciplinary Computational Research Experiences,"$659,861 ",,
2339286,EDU ,Berry College                                                   ,CAREER: Investigating Undergraduate Student Persistence Intentions for a Diverse Data Science Community,"$452,724 ",,
2339462,ENG ,University of Illinois at Urbana-Champaign                      ,CAREER: CAS- Climate -- Air-quality-related environmental justice impacts of decarbonization scenarios,"$406,342 ",,
2339524,CSE ,Harvard University                                              ,CAREER: Geometric Deep Learning to Facilitate Algorithmic and Scientific Advances in Therapeutics,"$328,354 ",,
2339619,ENG ,North Carolina State University                                 ,CAREER: Eradicate the Gate: Empowering Learners and Equalizing Assessment in K12 Engineering Education,"$338,886 ",,
2339621,BIO ,Harvard University                                              ,CAREER: Microbial Mediation of Temperate Tree Responses to Climate Change,"$514,088 ",,
2339913,MPS ,Harvard University                                              ,CAREER: Epitaxial stabilization of non-perovskite oxide quantum materials,"$346,170 ",,
2340108,SBE ,Trustees of Boston University                                   ,CAREER: Dynamics of Women's Political and Economic Empowerment: An Open Database Project,"$87,683 ",,
2340576,EDU ,Winston-Salem State University                                  ,"CAREER: Recruitment, Retention, and Graduation: Increasing Representation among Psychology Ph.D. Recipients","$548,566 ",,
2341036,EDU ,University of Chicago                                           ,Student Engagement in Mathematics: A Longitudinal Study of Classroom and Psychosocial Processes,"$845,762 ",,
2341434,SBE ,SUNY at Albany                                                  ,"Re-presenting population science data in the context of shifting demographic dynamics, climate change and alternative epistemologies","$253,965 ",,
2341629,SBE ,Cornell University                                              ,"DDRIG: Ethereal infrastructure: Placelessness, nature, and low-earth-orbit satellite internet constellations","$21,443 ",,
2341739,SBE ,Arizona State University                                        ,Collaborative Research: Effective Design of Institutions and Data Sharing Platforms in International Environmental Agreements,"$109,723 ",,
2341740,SBE ,Purdue University                                               ,Collaborative Research: Effective Design of Institutions and Data Sharing Platforms in International Environmental Agreements,"$86,800 ",,
2341785,SBE ,Harvard University                                              ,Pluralism in Biological Models of Sex,"$193,699 ",,
2341831,SBE ,Vanderbilt University                                           ,Critical developmental science: life course trajectories in the 1982 Pelotas birth cohort study,"$115,696 ",,
2341874,SBE ,University of California-Irvine                                 ,"Citizenship, Democracy, and Political Inclusion","$170,384 ",,
2341996,CSE ,Saint Louis University                                          ,SCC-PG: Internet of Waste: A Low-Cost Geospatial Sensor Network for Optimizing Solid Waste Management and Fostering Resident's Recycling Effectiveness Through Evidential Education,"$149,791 ",,
2342099,EDU ,University of Illinois at Chicago                               ,MyTurn: An Afterschool Social Robotics Program to Promote Interest in Computing Among Middle School Students,"$499,999 ",,
2342438,EDU ,University of Pennsylvania                                      ,Exploring Theory and Design Principles (ETD): Auditing Machine Learning Applications for Algorithmic Justice with Computer Science High School Students and Teachers,"$499,943 ",,
2342547,SBE ,Stanford University                                             ,Doctoral Dissertation Research: Factors Influencing Disproportionality in Land Dispossession,"$31,950 ",,
2342624,EDU ,George Mason University                                         ,Collaborative Research: Framework for Integrating Technology for Equity,"$434,522 ",,
2342625,EDU ,Bowling Green State University                                  ,Collaborative Research: Framework for Integrating Technology for Equity,"$302,718 ",,
2342626,EDU ,Wayne State University                                          ,Collaborative Research: Framework for Integrating Technology for Equity,"$254,853 ",,
2342627,EDU ,Middle Tennessee State University                               ,Collaborative Research: Framework for Integrating Technology for Equity,"$305,225 ",,
2342766,EDU ,University of Alabama Tuscaloosa                                ,Collaborative Research: Creating a Lasting LEGACY - Scaling a Peer-learning Community Model to Provide AP CS Preparation and Career Awareness for Black Young Women,"$583,488 ",,
2342767,EDU ,Cleveland State University                                      ,Collaborative Research: SEI: Creating a Lasting LEGACY - Scaling a Peer-learning Community Model to Provide AP CS Preparation and Career Awareness for Black Young Women,"$245,177 ",,
2342768,EDU ,Tuskegee University                                             ,Collaborative Research: SEI: Creating a Lasting LEGACY - Scaling a Peer-learning Community Model to Provide AP CS Preparation and Career Awareness for Black Young Women,"$146,347 ",,
2342769,EDU ,Oakland University                                              ,Collaborative Research: SEI: Creating a Lasting LEGACY - Scaling a Peer-learning Community Model to Provide AP CS Preparation and Career Awareness for Black Young Women,"$76,606 ",,
2342770,EDU ,Jackson State University                                        ,Collaborative Research: SEI: Creating a Lasting LEGACY - Scaling a Peer-learning Community Model to Provide AP CS Preparation and Career Awareness for Black Young Women,"$129,542 ",,
2342771,EDU ,Mississippi State University                                    ,Collaborative Research: SEI: Creating a Lasting LEGACY - Scaling a Peer-learning Community Model to Provide AP CS Preparation and Career Awareness for Black Young Women,"$266,541 ",,
2342772,EDU ,Central State University                                        ,Collaborative Research: SEI: Creating a Lasting LEGACY - Scaling a Peer-learning Community Model to Provide AP CS Preparation and Career Awareness for Black Young Women,"$91,059 ",,
2342821,MPS ,Harvard University                                              ,Conference: Emerging Statistical and Quantitative Issues in Genomic Research in Health Sciences,"$61,920 ",,
2342842,SBE ,Lehigh University                                               ,NSF-JST: An Inclusive Human-Centered Risk Management Modeling Framework for Flood Resilience,"$499,271 ",,
2343025,EDU ,University of Nebraska at Omaha                                 ,A Catalyst for Intersectional Gender Equity in STEM at the University of Nebraska at Omaha,"$301,457 ",,
2343111,SBE ,William Marsh Rice University                                   ,Collaborative Research: Incentivizing and Spotlighting Scientific Contributions in Legislative Studies,"$118,007 ",,
2343112,SBE ,University of Illinois at Urbana-Champaign                      ,Collaborative Research: Incentivizing and Spotlighting Scientific Contributions in Legislative Studies,"$96,253 ",,
2343113,SBE ,University of Wisconsin-Madison                                 ,Collaborative Research: Incentivizing and Spotlighting Scientific Contributions in Legislative Studies,"$86,291 ",,
2343233,GEO ,Harvard University                                              ,Collaborative Research: Time-dependent imaging of earthquake cycle behavior across the Japan fault system,"$227,954 ",,
2343235,EDU ,Texas A&M University Corpus Christi                             ,Collaborative Research: AGEP ACA: An HSI R2 Strategic Collaboration to Improve Advancement of Hispanic Students Into the Professoriate,"$278,818 ",,
2343236,EDU ,New Mexico State University                                     ,Collaborative Research: AGEP ACA: An HSI R2 Strategic Collaboration to Improve Advancement of Hispanic Students Into the Professoriate,"$156,529 ",,
2343292,SBE ,University of California-Los Angeles                            ,2024 Collaborative Multiracial Post-Election Survey,"$849,995 ",,
2343306,SBE ,Case Western Reserve University                                 ,"Doctoral Dissertation Research: Health, Wellness, and Indigenous Knowledge: A Community-Based Participatory Research Study","$30,731 ",,
